Id,Title,Year,ConferenceId,JournalId,Keyword
1713119,Can climate trends explain the damage in central Swedish lowland forests?,1991,0,9339,
1713154,The NASA LWS Sentinels Mission,2006,0,0,
1713431,Predictable yield-driven circuit optimization,1992,4393,0,
1713501,A REVISED FORM FOR THE JOHNSON–COOK STRENGTH MODEL,1998,0,5426,
1713554,"Implementing Causality Tests with Panel Data, with an Example from LocalPublic Finance",1989,0,0,
1714214,Virtual reality simulator of transurethral resection of the prostate,2009,3926,0,Computerized surgery simulation and training; Transuretral resection of the prostate
1714576,“Click” Modification of Silica Surfaces and Glass Microfluidic Channels,2007,0,1880,
1715226,Performance Analysis of Synchronization and Recovery Schemes,1985,0,12,
1716524,Aligned array FETs as a route toward THz nanotube transistors,2005,0,0,
1716678,Motor Schema-Based Formation Control for Multiagent Robot Teams,1995,748,0,
1716913,"Leucine-Rich Repeat Kinase 2 Colocalizes with α-Synuclein in Parkinson’s Disease, but Not Tau-Containing Deposits in Tauopathies",2008,0,8042,"Lewy bodies,Leucine-rich repeat kinase 2,Parkinson’s disease,Synuclein"
1717894,Adapser: an LALR(1) Adaptive Parser,0,0,0,
1719540,Practical version of the Asymptotic Linearity Theorem with applications to the additivity problems of thermodynamic quantities,1993,0,2147,
1721110,QoS Middleware for the Next-Generation Internet,1998,0,0,
1721808,Evaluation of a local DC load flow screening method for branch contingency selection of overloads,1988,0,5360,
1721841,Schooling and Human Capital Formation in the Global Economy,0,0,0,
1722788,Remarks on lattices of contact relations,0,0,0,
1723743,Extracting information ASAP!,2010,4662,0,
1723881,,2011,0,11676,Accretion; Solar nebula; Radiative transfer; Planetary formation
1725318,View Synthesis along a curve from two uncalibrated views,2005,0,0,
1725915,Optimization of Dynamic Gait for Bipedal Robots,0,0,0,
1726260,Information seeking and mediated searching study. Part 3. Successive searching,2002,0,141,
1726894,A flexible Architecture for Driver Assistance,0,1589,0,"Keywords: Computer Vision, Architecture, Intelligent Vehicles, Intelligent Cruise Control, Driver Assistance"
1726973,,1999,0,5383,
1729199,"Growth Retardation, Early Death, and DNA Repair Defects in Mice Deficient for the Nucleotide Excision Repair Enzyme XPF",2004,0,7758,Xeroderma pigmentosum (XP) is a human genetic disorder which is characterized by sensitivity to sunlight and an in-
1729547,Dictionnaire du francais branch,1986,0,0,
1729869,Probabilistic Bounds on the Performance of List Scheduling,1986,0,147,
1729948,Nerve Garden: A Public Terrarium in Cyberspace,1998,469,0,
1730810,Modeling of the bacterial-growth curve,0,0,0,
1730841,Cartel Deception in Nonrenewable Resource Markets,1982,0,0,
1731154,INFORMATION AND PROCESS FLOW IN MODELS OF PRECAST CONCRETE DESIGN AND CONSTRUCTION,0,0,0,"KEY WORDS Process modeling, precast prestressed concrete, construction management, engineering design, product model."
1732068,Training text classifiers with SVM on very few positive examples,2003,0,0,
1732439,Manipulation of crystal shape by cycles of growth and dissolution,2007,0,1875,
1733211,IgE Binding Areas with Similar Physicochemical Properties Mediate Cross-Reactivity Between Peanut and Tree Nut Allergens,2011,0,3443,
1734500,A standardized clinical evaluation of patients affected by facioscapulohumeral muscular dystrophy: The FSHD clinical score,2010,0,3917,
1736019,An Experimental System for Automated Paper Recycling,1997,1229,0,
1736261,Web content summarization using social bookmarks: a new approach for social summarization,2008,494,0,"Keywords Social summarization, social bookmarking service, user feedback"
1737807,Fate and Impact of Contaminants in Sediments of the NE United States,2002,0,0,
1737828,Uniform access to the cameraverse,2010,0,0,
1738530,"R'egulation de charge dans les syst`emes distribu'es et 
                  parall`eles",1995,0,0,
1739353,Structures and energies of isomeric C3H62+ dications,1989,0,2083,
1740817,The candidate oncogeneZNF217 is frequently amplified in colon cancer,2004,0,3692,
1740892,Adaptive switch from infanticide to parental care: how do beetles time their behaviour?,2007,0,1677,
1741164,"The Minor-Order Obstructions for The Graphs of Vertex
Cover Six",2000,0,0,
1741462,CODEWEAVE: Exploring Fine-Grained Mobility of Code,2004,0,247,"Keywords: code mobility, specification and semantics, distributed systems"
1741499,Manufacturing-Execution-System (MES) - Anwendernutzen am Praxisbeispiel,2001,0,276,
1742654,Academic rankings and research governance,2010,0,0,
1742963,DNA-mediated redox signaling for transcriptional activation of SoxR,2009,0,919,
1743110,Geology of 243 Ida,1996,0,11676,
1743630,Opportunistic social dissemination of micro-blogs,0,0,785,Social networking; Opportunistic; Mobile; Data dissemination; Micro-blogs
1743968,On the Modular Representation of Architectural Aspects,2006,1976,0,"Keywords: Architecture Description Languages, Aspect-Oriented Software Development, Architectural Connection."
1744194,Observations on practically perfect CSCW,1999,0,0,
1745045,Deep centers and their spatial distribution in undoped GaN films grown by organometallic vapor phase epitaxy,1998,0,8449,
1746687,On-Line High-Resolution Sonar Image Recognition Technique for Autonomous Underwater Vehicles,2008,0,0,KEY WORDS: Acoustic; Recognition; AUV; Image; Underwater; Sonar
1746753,Valeurs principales associ'ees aux temps locaux brown-iens,1987,0,0,
1747270,Cytoplasmic Domain of Zebrafish Myelin Protein Zero: Adhesive Role Depends on beta-Conformation,2007,0,1495,
1748649,On the number of strongly ℵε-saturated models of power λ,1987,0,237,
1748680,Identification of the Cystic Fibrosis Gene: Chromosome walking and Jumping,1990,0,3999,
1748775,TAYLOR II manufacturing simulation software,1998,520,0,
1749953,"Dynamic properties of 
 <i>Drosophila</i>
 olfactory electroantennograms",2008,0,1665,Keywords AntennaChemosensoryNoiseOdor � Frequency response
1750385,On factorization of nonlinear ordinary differential equations,1999,98,0,
1750679,"An Accurate, Sensitive, and Scalable Method to Identify Functional Sites in Protein Structures",2003,0,7737,"SGI, structural genomics initiative; ET, Evolutionary Trace"
1751112,DNA Microarrays: Kinetics of Hybridization to a Polyelectyrolyte Brush,2001,0,0,
1752826,Adaptive multimodal dialogue management based on the information state update approach,2004,0,0,
1753835,"Effects of a Flaxseed-Derived Lignan Supplement in Type 2 Diabetic Patients: A Randomized, Double-Blind, Cross-Over Trial",2007,0,4130,
1754233,Modeling of nitromethane flame structure and burning behavior,2007,0,5739,Nitromethane; Monopropellant; Liquid propellant; Combustion modeling
1755454,"Collecting, Analyzing and Interpreting Data for User Model Acquisition in Open Web-Based Adaptive Collaborative Environment",2003,122,0,
1755873,Distributed Control Parallelism for High Speed Civil Transport MDO,1999,230,0,
1756458,,1972,0,6569,
1756858,Research report Left-hemispheric superiority for visuospatial orientation in homing pigeons,0,0,0,Keywords: Visuospatial behavior; Laterality; Brain asymmetry; Pigeon; Homing
1757421,Distribution of human endogenous retrovirus HERV-K genomes in normal and malignant human tissues and in different primates,1995,0,3493,
1757554,Effects of Butyrate on Intestinal Barrier Function in a Caco-2 Cell Monolayer Model of Intestinal Barrier: ,2007,0,4084,
1757775,Activation of memory and virgin B cell clones in hyperimmune animals,1987,0,6627,
1758128,Human-Assisted Virtual Environment Modeling for Robots,1999,0,208,"Keywords: virtual reality, modeling, man-machine interaction"
1758486,A direct symbolic approach to model checking pushdown systems,1997,0,355,
1759220,Cusp diamagnetic cavity observations: A new challenge for theory and simulation,2006,0,0,
1759891,Correlation in Vertically Stacked CdSe Based Quantum Islands,2002,0,8576,
1760262,Dipsogenic Factors Operating in Chronic Uremics on Maintenance Hemodialysis,1994,0,3949,"Thirst,Overhydration,Hemodialysis,Sodium,Potassium,Urea,Angiotensin II"
1760611,Evaluation of a swan's neck osteotome for pterygomaxillary dysjunction in the Le Fort I osteotomy,1993,0,2761,
1760638,An Asymmetric Criterion for Cluster Validation,0,0,0,
1760796,Real-time programming in Common Lisp,1991,0,209,Lisp|garbage collection|macros|real-time programming|type declaration
1760914,An isotope dilution method to measure nitrification rates in the northern Gulf of Mexico and other eutrophic waters,2010,0,8854,Nitrification; Eutrophication; 15Nitrate; Isotope tracer; Isotope dilution; HPLC
1760965,Ph+ CML with 7q− and prolonged chronic phase,1992,0,2803,
1761074,Analyzing Third World Urbanization: A Model with Empirical Evidence.,1990,0,10418,
1762095,"PRISIM at Arkansas Nuclear One—unit 1: Daily, in-plant use of PSA information",1988,0,5785,
1762508,,2010,0,9481,Emotional reactivity; Affective cue; Self-reported arousal; Heart rate variability; Psychophysiology; College students
1762761,Efficient Rotation-Discriminative Template Matching,2007,792,0,"Keywords: template, matching, rotation, gradient, histogram."
1762795,On systems of difference equations with wrong boundary conditions,1969,0,902,
1763475,Stress and bias field dependence of initial permeability in amorphous Co(75-x)Fe(x)Si15B10,1994,0,8422,
1765264,A chaincode based scheme for fingerprint feature extraction,2006,0,419,Keywords: Fingerprint; Minutiae; Features extraction; Biometrics; Chaincode
1765385,Hybrid polishing mechanism of single crystal SiC using mixed abrasive slurry (MAS),2010,0,5165,Silicon carbide (SiC); Polishing; Mechanism
1766159,A relationship between the diameter and the intersection number c2 for a distance-regular graph,2011,0,0,Mathematics - Combinatorics
1766572,High Performance Implementation of MPI Derived Datatype Communication over InfiniBand,2004,80,0,
1767015,Accelerating the kernels of BLAST with an efficient PIM (processor-in-memory) architecture,2004,0,0,"Index Terms— BLAST, Processor-In-Memory (PIM) Architecture, Sequence Alignment."
1767672,Predicting the quality and prices of Bordeaux wines,2007,0,0,"wine quality, wine prices, weather, Bordeaux wine, wine auctions, Demand and Price Analysis, Environmental Economics and Policy,"
1767789,,1996,0,7967,
1768691,The Broad Autism Phenotype Questionnaire,2007,0,9725,Keywords Autism Broad autism phenotype Assessment
1770397,On the Importance of Tuning in Incremental View Maintenance: An Experience Case Study,2000,619,0,
1770930,Quiet and Bouncing Objects: Two Migration Abstractions in a Simple Distributed Blue Calculus,1998,0,0,
1771431,A hybrid quantization scheme for image compression,2004,0,31,Image compression; Quantization; Wavelet coefficient tree; Measure of coarseness
1771605,Noninvasive monitoring of drug biodistribution and metabolism: studies with intraarterial Pt-195m-cisplatin in humans,1989,0,0,
1771800,Global Synchronization in Sensornets,2004,131,0,
1771821,A Cultural Perspective on the Structure of Student Interest in Science,2011,0,10710,"Large‐scale studies,Scientific literacy,Structural equation modelling,Interest,Motivation,Cultural context"
1772119,Analogy just looks like high level perception: why a domain-general approach to analogical mapping is right,1998,0,114,"Keywords : analogy, similarity, structure-mapping, cognitive simulation, qualitative physics"
1774027,SPECIFIC-ACTIVITY DETERMINATION WITH BETA AND UV-PHOTON COUNTER,1955,0,0,
1774195,NMR investigations of the dynamics of the aromatic amino acid residues in the basic pancreatic trypsin inhibitor,1975,0,1601,
1774270,Digital Filters for Accurately Verifying the Performance of Hearing Protectors in Use,2010,0,8336,
1775382,Optimal scheduling in cooperate-to-join Cognitive Radio Networks,2011,69,0,Optimal scheduling; Cognitive radio; Base stations; Schedules; Relays; Scheduling algorithm; ; 
1775782,Dynamic evolution of energetic outer zone electrons due to wave-particle interactions during storms,2007,0,15256,
1775793,Estimating Monotonic Functions and Their Bounds,1999,0,0,
1775859,Intention-to-treat analysis and the goals of clinical trials*,1995,0,2929,
1776282,Does More for the Poor Mean Less for the Poor? The Politics of Tagging,1999,0,0,
1776548,"On the Pless-construction and ML decoding of the (48, 24, 12) quadratic residue code",2003,0,433,
1776646,CRAMER-RAO BOUND APPROACH TO SUPER- RESOLUTION ARRAY DESIGN,0,0,0,
1776940,Metallic clusters in strong femtosecond laser pulses,1997,0,8491,
1777221,A Modal Logic with Context-Dependent Inference for Non-Monotonic Reasoning,1996,654,0,
1777619,Computationally Grounded Model of BDI-Agents,2005,64,0,
1778305,Optimization in constraint networks,1990,0,0,
1778584,Monotonic conflict resolution for inheritance,1992,0,0,
1778931,Periparturient and Postpartum Endocrine Changes of Conceptus and Maternal Units in Jersey Cows Bred for Milk Yield,1981,0,1275,
1779127,Reputation and Distribution in a Gift Giving Game,1996,0,0,
1780084,Analytical modelling of suction cups used for window-cleaning robots,2006,0,7021,Window-cleaning robot; Suction cup; Analytical modelling
1780471,A study of 137Cs in soil profiles from the Marshall Islands,1996,0,6173,
1781093,Consumentengedrag met betrekking tot de kwaliteit van voedingsmiddelen,1993,0,0,Leerstoelgroep Marktkunde en consumentengedrag
1781194,"Genome-wide association study identifies susceptibility loci for polycystic ovary syndrome on chromosome 2p16.3, 2p21 and 9q33.3",2010,0,7779,
1781458,Some Features of a Novel Gas Dispersion Impeller in a Dual-Impeller Configuration,2003,0,1945,
1782547,On Tractability of Path Integration,1995,0,0,
1782607,LEARNING TO SEE ANALOGIES: A CONNECTIONIST EXPLORATION,1997,0,0,
1783302,Interaction of hydrogen with defects in metals,1985,0,5708,
1783502,,2008,0,0,
1783556,Depressive Symptomatology among HIV-Positive Women in the Era of HAART: A Stress and Coping Model,2006,0,9495,Keywords HIV . Depression . Women . Coping . Stress . Health
1783575,Anthropogenic Drivers of Ecosystem Change: an Overview,0,0,0,
1783838,Scattering from conductors coated with materials of arbitrary thickness,1992,0,5335,
1784476,Interventional cardiologyHand me your radial artery to protect your kidney,2010,0,3931,
1784717,A Reconfigurable Delta-Sigma ADC,2006,0,0,
1784990,Identification of Contaminant Source Location and Release History in Aquifers,2001,0,5547,
1784993,"Foundations of Markov-Perfect Industry Dynamics. Existence, Purification, and Multiplicity",2003,0,0,
1785215,Explicitly covariant light-front dynamics and some its applications,2002,0,0,"Nuclear Theory, High Energy Physics - Phenomenology, High Energy Physics - Theory"
1786841,Compiler Optimization Techniques for Improving Distributed Object Computing Framework Performance over High-speed ATM Networks,0,0,0,
1787490,Optical Character Recognition: Neural Network Analysis of Hand-Printed Characters,1998,1594,0,
1788202,Building efficient wireless sensor networks with low-level naming,2001,0,190,
1788293,Human and Machine Collaboration in Creative Design,1996,654,0,
1788545,Single-point magnetic resonance imaging (MRI) of cement based materials,2003,0,6909,I~SUMF~
1789569,Asymptotic Properties of Minimax Trees and Game-Searching Procedures,1980,0,242,
1790086,Properties of Ru-Ta alloys as gate electrodes for NMOS and PMOS silicon devices,2001,3689,0,
1791364,"Looking Back: Marriage, Divorce and Out-of-Wedlock Births",2005,0,0,
1791927,Genoprotective pathways,2004,0,7775,DNA; Isopentenyl diphosphate; Oxidative stress
1792365,Eingliederungszuschüsse und Entlohnung: empirische Evidenz auf Basis von Individualdaten,2010,0,0,
1792478,PHOTOEMISSION INSTABILITIES: THEORY AND EXPERIMENT,1998,0,0,
1792649,Enhanced Anticonvulsant Activity of Ganaxolone after Neurosteroid Withdrawal in a Rat Model of Catamenial Epilepsy,0,0,0,
1793101,Influence of process parameters on the deep drawing of stainless steel,2007,0,5270,Deep drawing; Process parameters; Stainless steel; FEM; Taguchi technique; ANOVA
1793113,,2007,0,8737,Sturgeon; Endoscopy; Ovarian histology; Gender identification
1794077,Image Sequence Analysis to Investigate Dynamic Processes,2000,0,0,
1794469,Hematocolpos. Imperforación del himen en adolescente,2008,0,0,
1794573,An overview of the coupled atmosphere-wildland fire model WRF-Fire,2011,0,0,
1794796,A view of the parallel computing landscape,2009,0,209,
1795404,Mechanically alloyed Zr–Cu–Al–Ni–C glassy powders,2004,0,6901,Multicomponent glasses; Mechanical alloying; Supercooled liquid behaviour; Crystallisation kinetics; Johnson–Mehl–Avrami model
1795694,Structured Parallel Computation in Structured Documents,1995,0,143,
1795704,Midinfrared properties of cuprous oxide: High-order lattice vibrations and intraexcitonic transitions of the 1s paraexciton,2005,0,8566,Excitons and related phenomena
1795918,The Timewheel Asynchronous Atomic Broadcast Protocol,1997,214,0,
1797167,Effective Low Power BIST for Datapaths,2000,618,0,
1797170,Bilayered Approximate Integration for Rapid and Plausible Animation of Virtual Cloth with Realistic Wrinkles,2002,1621,0,
1797270,Self-consistent harmonic generation in storage ring FELs,2003,0,5707,Storage ring; Free electron laser; Harmonic generation; Q-switch mode
1797883,Diffraction of matter waves in space and in time,1997,0,8565,"Atom and neutron optics, Diffraction and scattering, Mechanical effects of light on atoms, molecules, electrons, and ions"
1798208,Bifurcation of a shaft with hysteretic-type internal friction force of material,2003,0,5105,
1799151,IST R&D PROJECT SHARED-COST RTD PROJECT HUMAN LANGUAGE TECHNOLOGIES PROJECT OFFICER: YVES PATERNOSTER,0,0,0,
1799491,A multifold coincidence-veto circuit using transistors,1961,0,14034,"ENGINEERING AND EQUIPMENT CIRCUITS, COINCIDENCE METHODS, COUNTERS, PERFORMANCE, TRANSISTORS"
1800963,Cluster-Based Nearest-Neighbour Classifier and Its Application on the Lightning Classification,2008,0,104,"Keywords nearest-neighbour classifler, clustering, adaptive distance"
1801386,Syndetic Modelling: Computer Science Meets Cognitive Psychology,2001,0,355,
1801477,Dynamic retinal image reconstruction of the human eye,1999,4962,0,
1801675,Continuous interaction in future computing systems,2002,0,944,
1802049,Characterization of Fixed and Reconfigurable Multi-Core Devices for Application Acceleration,2010,0,768,Computational density per watt|internal memory bandwidth
1803324,Arc-Disjoint Paths in Expander Digraphs,2001,706,0,
1805079,Dynamic intuitionistic fuzzy multi-attribute decision making,2008,0,67,
1805197,On Aspect-Orientation in Distributed Real-time Dependable Systems,2001,0,0,
1805284,"Transparency, Political Polarization, and Political Budget Cycles in OECD Countries",2006,0,10116,
1805812,A GPS-aided survey for assessing trip reporting accuracy and travel of students without telephone land lines,2012,0,5873,"GPS,travel survey,trip under-reporting,land line telephone,prompted recall"
1806155,,2009,0,7892,Atomoxetine; cognition; fMRI; impulsiveness; impulsivity; inhibition; neuromodulation; noradrenaline; SSRT; stop-signal
1806301,New morphological approach to edge detection and image restoration,1997,0,0,
1806712,KI-Modellierung in den Sozialwissenschaften,1991,0,155,
1806950,"Structural, magnetic and transport properties of Co2FeSi Heusler films",2007,0,8493,
1807291,Preconditioned edge-preserving image deblurring and denoising,2001,0,419,
1807989,Verification Problems in Conceptual Workflow Specifications,1998,0,153,Workflow; Verification; Computational complexity
1808618,Viscoelasticity of Entangled Semiflexible Polymers via Primitive Path Analysis,2008,0,0,"Molecular dynamics, Brownian dynamics, Linear viscoelasticity, Growth from melts; zone melting and refining"
1808625,Constructable Petri Nets,1985,0,120,
1809509,Numerical solution of a Newtonian jet emanating from a converging channel,1992,0,4487,
1809639,Improved steam gasification of lignocellulosic residues in a fluidized bed with commercial steam reforming catalysts,1993,0,5383,
1810729,Inductive methods for proving properties of programs,1973,0,209,computational induction|least fixedpoint|recursive programs|structural induction
1810926,Delta-SimRank computing on MapReduce,2012,0,0,SimRank|delta-SimRank|distributed computing
1812398,Structure and Function of Photolyase and in Vivo Enzymology: 50th Anniversary,2008,0,1647,
1813379,Input modeling when simple models fail,1995,520,0,
1813578,A novel route for processing cobalt-chromium-molybdenum orthopaedic alloys,2010,0,7844,
1813794,Thermopower and electrical conductivity of sodium-doped V2O5 thin films,2007,0,8449,
1813903,Afriat's Theorem and Some Extensions to Choice under Uncertainty,2011,0,0,
1815703,Monetary Policy Committees,0,0,0,
1815766,Isotonic Median Regression via Scaling,0,0,0,"Keywords: isotonic regression, median regression, tree order, biva riate, dimensional ordering, scaling, classification"
1815997,Transformer joints FE analysis using pseudo-source technique,2010,3678,0,
1816526,Pronunciation variations of Spanish-accented English spoken by young children,2005,0,0,
1816646,Auroral emission profiles extracted from three-dimensionally reconstructed arcs,1996,0,15256,
1891108,Backjumping in State-Space Search,1996,654,0,
1816953,Shape Analysis with Structural Invariant Checkers,2007,335,0,
1816982,A Reinforcement Learning Algorithm Applied to Simplified Two-Player Texas Hold'em Poker,2001,661,0,
1818296,Detection of Denial-of-QoS Attacks Based On X2 Statistic And EWMA Control Charts,2002,441,0,
1818957,Taxonomy of educational objectives: the classification of educational goals: handbook i,0,0,0,
1820121,Linear Authentication Codes: Bounds and Constructions,2001,1196,0,
1820309,Movement of cortical actin patches in yeast,1996,0,7723,
1820877,An Image-Based Bayesian Framework for Face Detection,2000,838,0,
1821298,Pyrones as Substrates for Palladium-Catalyzed [4 + 3] Cycloadditions,1989,0,1885,
1821599,,2002,0,2748,
1821668,Electronic dispersion compensation by signal predistortion using a dual-drive Mach-Zehnder modulator,2005,4609,0,
1821768,Recent advances in visibility determination for large and complex virtual environments,2004,466,0,
1822031,An algebra for specifying valid compound terms in faceted taxonomies,2007,0,153,"Keywords: conceptual modelling, faceted taxonomies, semantics, information services on the web."
1824374,Aggregate Employment Dynamcis and Lumpy Adjustment Costs,1991,0,0,
1824932,Why Should Governments Issue Bonds?,1993,0,0,
1825451,,1955,0,15339,
1825568,Roughian -- Rough Information Analysis,2001,0,59,
1826363,A degeneration formula of Gromov-Witten invariants with respect to a curve class for degenerations from blow-ups,2004,0,0,"Mathematics - Algebraic Geometry, High Energy Physics - Theory, 14N35, 81T30"
1826459,The November meeting in Cleveland,1973,0,7104,
1826964,,1999,0,4303,
1826976,118. Detection and quantification of swine vesicular disease virus by TaqMan® RT-PCR assay,2003,0,9310,
1827727,"ERP Implementation, Cross-Functionality and Critical Change Factors",2003,26,0,"Keywords: ERP, cross-functional, change, functional coverage, lifecycle, critical success factors."
1828620,SOREX: Subspace Outlier Ranking Exploration Toolkit,2010,219,0,
1828781,Die Organisation von Rechnerverbundsystemen - Alternativen und Entscheidungshilfen,1980,0,236,
1829743,Downlink Coordinated Radio Resource Management in Cellular Networks With Partial CSI,2012,0,854,
1830274,Page-based optimistic concurrency control for memory-mapped persistent object systems,1995,736,0,
1831839,"Protein.3D Structural Data - Where It Is, and Why We Need It",2002,0,280,
1831902,The T Cell Leukemia Oncoprotein SCL/tal-1 Is Essential for Development of All Hematopoietic Lineages,1996,0,7592,
1833311,Dynamics of interstitial hydrogen molecules in crystalline silicon,2001,0,8492,
1833490,Receptivity in Mongolian gerbils: dose and temporal parameters of ovarian hormone administration,1986,0,9161,Keywords: Gerbillinae; Sex behaviour; Oestrogens; Progesterone
1833675,Estimates of the effect of Southern Ocean iron fertilization on atmospheric CO2 concentrations,1991,0,912,
1833880,POROSITY OF JULIA SETS OF NON-RECURRENT AND PARABOLIC COLLET{ECKMANN RATIONAL FUNCTIONS,2000,0,0,
1834089,,1999,0,7512,
1834540,A Web-Based Information System for Stock Selection and Evaluation,1999,485,0,
1835034,Strong Stems in the German Mental Lexicon: Evidence from Child Language Acquisition and Adult Processing1,0,0,0,
1835342,The Modal Logic of Probability,1998,403,0,
1835508,Feature Combinations from Support Vectors,0,0,0,"Keywords : Support Vector Machines, Kernel Method, Data Mining, PrefixSpan, Dependency Analyisis"
1835715,A common topology for bacterial and eukaryotic transcription initiation?,2007,0,7658,"DNA supercoiling,HMGB proteins,plectonemic DNA,RNA polymerase,TFIID"
1836390,Dense medium radiative transfer theory: comparison with experiment and application to microwave remote sensing and polarimetry,1990,0,5350,
1836844,On the Workability of Market Socialism.,1994,0,0,
1837375,,2010,0,3443,
1837940,Multichannel Blind Deconvolution: Fir Matrix Algebra And Separation Of Multipath Mixtures,1996,0,0,
1838860,Multi-View Object Detection by Classifier Interpolation,2010,2771,0,
1839028,Backward Model for Multi-Primary Display Using Linear Interpolation on Equi-luminance Plane,2002,1184,0,
1840023,,2007,0,15256,
1841169,Embodied user interfaces for really direct manipulation,2000,0,209,
