Id,Title,Year,ConferenceId,JournalId,Keyword
1123650,Numerical Solutions of Optimal Control for Thermally Convective Flows,1997,0,5439,"optimal control, Navier-Stokes equations, finite element method"
1123676,Auto-stabilisation Efficace,2000,0,0,
1124015,Identifying axial load patterns using space frame FEMs and measured vibration data,2009,0,5671,
1125711,Use of Web-Based Live Demos in Computer Science Courses,2003,47,0,
1125875,Optimal Defaults and Active Decisions,2005,0,0,
1126047,Gallium nitride based high power heterojunction field effect transistors: process development and present status at UCSB,2001,0,5347,
1126711,High-gain n-p-n and p-n-p InGaAs/InAlAs double-heterojunction bipolar transistors with InAs cap layers by molecular-beam epitaxy,1988,0,5347,
1126960,RTG-dependent Mitochondria-to-Nucleus Signaling Is Regulated by MKS1 and Is Linked to Formation of Yeast Prion [URE3],2002,0,7751,Key Words: MKS1; retrograde regulation; mitochondrial dysfunction; (URE3); prion
1128586,An application of neural nets to the Rome precipitation series (1782–1989),1995,0,13596,
1129250,On Testing for Unit Roots in Market Shares,1999,0,0,
1129663,Functional genomic signatures of sponge bacteria reveal unique and shared features of symbiosis,2010,0,7481,"bacteria,function,metagenomics,sponge,symbiosis"
1130022,,2004,0,1462,
1130348,Embedded Block Coding in JPEG 2000,2000,1096,0,
1131135,Somatic tetraploidy in specific chick retinal ganglion cells induced by nerve growth factor,2010,0,919,
1131718,Multi-granular Spatio-temporal Object Models: Concepts and Research Directions,2009,0,0,
1132143,A Distributed MAC Scheme Supporting Voice Services in Mobile Ad Hoc Networks1,0,0,0,"Index Terms - medium access control, code-division multiple access, mobile ad hoc networks, statistical multiplexing."
1132678,Entropy coding of composite sources modeled by infinite Gaussian mixture distributions,1996,3544,0,
1132891,Mechanistic Studies of Catalytic Olefin Dimerization Reactions Using Electrophilic η<sup>3</sup>-Allyl−Palladium(II) Complexes,1996,0,2083,
1133440,System Diagnosis using Hybrid Failure Propagation Graphs1,2004,0,0,
1133569,Exclusive semileptonic and rare B meson decays in QCD,1998,0,8568,"Decays of bottom mesons, Sum rules, Electroweak radiative corrections"
1134860,India and Madagascar in Gondwanaland based on matching Precambrian lineaments,1979,0,912,
1134899,Fucusing and Proof-Nets in Linear and Non-commutative Logic,1999,143,0,
1136448,NTT and NOT spectroscopy of SDSS-II supernovae,2011,0,11644,"methods: observational, techniques: spectroscopic, supernovae: general, surveys, cosmology: observations"
1136721,Delayed nucleation at a weakly first-order transition,1986,0,8570,"Metastable phases, Phase transitions and Curie point"
1137458,A Formal Type System for Java,2007,0,129,
1139693,The computing and communication architecture of the DLR Hand Arm System,2011,2821,0,Hardware; Field programmable gate arrays; Actuators; Temperature sensors; Protocols; Robots; ; 
1139820,Architectural and Functional Features of Matrix Module (MAMO),1983,57,0,
1139852,Price Level Targeting vs.  Inflation Targeting,1999,0,0,
1140336,Mice congenic for a locus that determines phenotype in the neuroma model of neuropathic pain,2006,0,7951,Autotomy; Chronic pain; Congenic; Heritability; Neuroma; Neuropathic pain; Pain genes
1140515,SS Aurigae (observations),1925,0,0,
1140851,Contribution of high-degree frequency splittings to the inversion of the solar rotation rate,0,0,0,
1141523,LXXXVIII. The forces between atoms and chemical affinity,1914,0,16606,
1141644,Synchron-Duplex-Rechner,1984,306,0,
1141660,Financial characteristics and prediction on targets of M&A based on SOM- Hopfield neural network,2007,4018,0,Hopfield neural network; Mergers & acquisitions; financial characteristics; self-organized mapping neural network
1141799,Nickel induced phase separation and nanocrystal growth in Si-rich silica films,2006,0,6942,
1142104,Enhanced emotion-induced amnesia in borderline personality disorder,2007,0,9926,
1142614,Microwave photonic filter with triangle shaped infinite impulse response,2008,0,5222,
1143293,"Hall coefficient and magnetoresistance of 2D spin-polarized electron
  systems",2006,0,8566,
1143645,The design of ZigBee communication convertor based on CAN,2010,3327,0,CAN bus; Communication; MCU; ZigBee
1143778,The C. elegans TGF-β Dauer Pathway Regulates Longevity via Insulin Signaling,2007,0,1556,SIGNALING; DEVBIO
1143779,Double-sided silicon strip detectors in Pisa,1994,0,0,Detectors and Experimental Techniques
1143976,Local positive feedback by calcium in the propagation of intracellular calcium waves,1995,0,1495,
1144187,Estimation of Model Error Covariance Matrices of Extended Kalman Filter for Validation of AMSR-E Soil Moisture Product,2002,0,0,"1818 Evapotranspiration, 1833 Hydroclimatology, 1866 Soil moisture"
1144245,The effects of ageing and an environmental trust fund in an overlapping generations model on carbon emission reductions,2001,0,4684,C68; J19; H43; Q28; Q48
1144728,Succinct indexable dictionaries with applications to encoding <i>k</i>-ary trees and multisets,2002,378,0,
1145825,Learning in Relational Databases: A Rough Set Approach,1995,0,336,
1145938,Inverse Integer Transform in H.264/AVC Intra-frame Encoder,2011,863,0,area-efficient architecture; H.264/AVC; intra-frame encoder; inverse integer transform; low-latency; 
1146012,How to Make Efficient Fail-stop Signatures,1992,688,0,
1146328,Thorough analysis of quantum mechanical effects on MOS structure characteristics in threshold region,2000,0,906,MOS structure; Threshold voltage; QMEs; Model
1147969,On Classes of Problems in Asynchronous Distributed Systems with Process Crashes,1999,21,0,
1149064,Photonic Networks-on-Chip for Future Generations of Chip Multiprocessors,2008,0,18,chip multiprocessors; emerging technologies; interconnection networks; photonics
1149931,Temporal Logic Based Static Analysis for Non-uniform Behaviours,2003,705,0,
1150269,Wood gasification integrated with fuel cell-microturbine hybrid power plant,2002,4742,0,"Index Terms-. Fuel cells, gas turbines, power generation, robustness."
1151169,Long tails of marginal distribution and autocorrelation function of rainfall produced by the maximum entropy principle,2008,0,0,
1151334,FLOW-INJECTION CHEMILUMINESCENCE DETERMINATION OF UREA BY OXIDATION WITH N-BROMOSUCCINIMIDE,2001,0,1882,"Flow-injection,Chemiluminescence,Urea,Serum,N-Bromosuccinimide"
1151512,Mertens' theorem for toral automorphisms,2008,0,0,"Mathematics - Dynamical Systems, 37C35, 11J72"
1151624,Learning of Chua's circuit attractors by locally recurrent neural networks,2001,0,8371,
1151946,ChemInform Abstract: Chemical Transport of Rhenium and Rhenium Oxides.,2010,0,13179,
1152862,The fundamental form of a second-order homogeneous Lagrangian in two variables,2005,0,0,"Mathematics - Differential Geometry, 58E99"
1152896,Virtual environments for student fieldwork using networked components,1999,0,361,
1152989,Integrated scheduling of material handling and manufacturing activities for just-in-time production of complex assemblies,1998,0,5449,"Keywords: Just-In-Time Production, Makespan, Material Handling Systems Scheduling."
1154471,Design and fabrication aspects of a plutonium-incineration experiment using inert matrices in a “Once-Through-Then-Out” mode,2001,0,5767,plutonium incineration; partitioning and transmutation; inert matrices; spinel; zirconia
1156243,IMPACT: inter-hospital PACS testbed based on super high definition imaging system and ATM network for tele-diagnosis experiment,1999,3773,0,
1156541,Monoclonal gammopathy of undetermined significance and smouldering multiple myeloma: emphasis on risk factors for progression,2007,0,2756,
1157202,Safety as a Service,2009,0,129,
1157363,Multicast Routing in Internetworks and Extended LANs,2000,1652,0,
1157873,,1982,0,15256,
1158073,Principles of Airway Management: ,1990,0,4125,
1158517,How many relevances in information retrieval?,1998,0,61,Information retrieval; Relevance; Kinds of relevance; Relevance judgement; System design; System evaluation
1159421,Creating an Ambient-Intelligence Environment Using Multi-Agent System,2008,3734,0,Agent; Ambient Intelligence; Architecture; context-aware
1159925,Location and Geometric Description of Carpal Bones in CT Images,1994,1096,0,
1160354,Entropy Crises in Glasses and Random Heteropolymers,1997,0,0,Key words: entropy crises; glass transi- tions; random first order transitions; ran- dom heteropolymers.
1160728,Tolerating process variations in nanophotonic on-chip networks,2012,86,0,"Bandwidth,Heating,System-on-a-chip,Optical waveguides,Modulation,Optical device fabrication,,"
1161118,A new link-state availability model for reliable protection in optical WDM networks,2004,1073,0,"Keywords Availability, connection provisioning, link-state information, optical WDM network, protection, SLA."
1161249,Semiclassical Electron Transport in case of Spin-Orbit Interaction: a Way to Spin-Polarize the Current,2005,0,0,
1161298,Adult cancer survivors: How are they faring?,2005,0,2792,
1161546,Algorithmic approach to construct probabilistic grammatical models of command streams in interactive software systems,1990,0,301,
1162837,Fast Search in Transformation Spaces using Orbit Decomposition,0,0,0,
1163322,A study on the test of UPS by energy feedback method,1991,1223,0,
1163584,Antiquarian answers: book restoration as a resource for design,2011,789,0,binding|books|handcraft|handwork|material|skill|tool
1163612,"P3-10: Design of interaction cavity for 120 GHz, 1 MW gyrotron",2010,2974,0,Gyrotron; interaction cavity; limiting current; voltage depression; wall loss
1163792,Extended particle model for hadrons with surface tension,1975,0,0,
1164430,Effects of some vertebrate hormones on lipid mobilization in the insect fat body,1968,0,1611,
1164513,Special Issue on Recent Advances in Wireless Video SIGNAL PROCESSING: IMAGE COMMUNICATION,2002,0,5820,
1165113,TV Educational Program Unit Generation,2008,2679,0,
1167552,Quantum fluctuations in free-electron lasers,2005,0,0,"43 PARTICLE ACCELERATORSBEAM DYNAMICS, FLUCTUATIONS, FREE ELECTRON LASERS"
1169314,The Multicast Bandwidth Advantage in Serving a Web Site,2001,1402,0,
1169426,High compression image coding using an adaptive morphological subband decomposition,1995,0,416,
1169781,Observables for the Analysis of Event Shapes in e+e- Annihilation and Other Processes,1978,0,8570,
1170024,Field controlled nematic-to-isotropic phase transition in liquid crystal–carbon nanotube composites,2008,0,0,"carbon nanotubes, liquid crystal phase transformations, nematic liquid crystals, organic compounds, suspensions"
1172097,Buchbesprechungen,1976,0,7322,
1172486,Is Credit Event Risk Priced? Modeling Contagion via the Updating of Beliefs,2002,0,0,
1174013,Multicomponent prestack depth migration by scalar wavefield extrapolation,2002,0,6358,
1174524,Checkpointing Protocols in Distributed Systems with Mobile Hosts: A Performance Analysis,1998,80,0,
1174630,Über neuere Untersuchungen an Wandstrahlelementen und ihre Anwendung in logischen Schaltungen,1965,0,87,
1175652,Visual scan adaptation during repeated visual search,2010,0,3768,
1176570,Efficient matching pursuit image coding based on block partitioning,2009,0,5222,
1176739,"The Rank One Mixed |ì Problem and ""Kharitonov-Type"" Analysis",0,0,800,
1177227,Supporting energy-driven adaptations in distributed environments,2011,0,0,distributed environments|energy awareness|middleware
1177866,,1994,0,8396,
1178453,Topology Analysis and Design of Passive HEMT Millimeter-Wave Multiple-Port Switches,2008,0,5354,HEMT; monolithic microwave integrated circuit (MMIC); multiple port; single-pole single-throw (SPST); switch
1178692,Multiple Views with Multiple Behaviours for Interoperable Object-Oriented Database Systems,2003,628,0,
1178965,A Multi-Disciplinary Approach in Evaluating and Facilitating the Use of the Manus Robot,1999,38,0,
1179526,MITSuME Telescope Observation of GRB080506,2009,0,0,"gamma-ray sources; gamma-ray bursts, X-ray sources; X-ray bursts, Photography and photometry"
1179583,Searching a Simple Polygon by a k-Searcher,2000,84,0,
1180307,Runway Operations Planning: A Two-Stage Solution Methodology,2003,736,0,
1180554,Outcome of Patients with Diffuse Large B Cell Lymphoma is Directly Related to Type of Chemotherapy and the use of Radiation,2009,0,14303,
1181088,Design issues of ultra-wideband systems for high-rate wireless PANs: modulation schemes and coexistence with WLANs,2003,0,14634,
1181542,Similarity based retrieval from sequence databases using automata as queries,2002,572,0,automata|seuqence databases|similarity based retrieval
1181887,Programs and Types,1980,706,0,
1182044,Heavy-atom tunneling in cyclobutadiene:<i>Ab initio</i> calculation of the intensities of<i>a</i><sub><i>g</i></sub> Raman lines,1992,0,2369,
1182931,A review of optical near-fields in particle/tip-assisted laser nanofabrication,2010,0,5751,
1183372,A priori error estimate for the Baumann–Oden version of the discontinuous Galerkin method,2001,0,7114,
1184040,Reporter mice to detect and predict the toxicity of endocrine disruptors,2007,0,8318,
1184600,Comparison of the SYBR Green and the hybridization probe format for real-time PCR detection of HHV-6,2006,0,7510,Human herpes virus 6 (HHV-6); PCR; Real-time PCR
1184789,Layer bargaining: multicast layered video over wireless networks,2010,0,16,Video multicast; game theory; layered video
1184809,Blui: low-cost localized blowable user interfaces,2007,431,0,
1185539,Empirical performance prediction for IFFT/FFT cores for OFDM systems-on-a-chip,2002,3171,0,
1185552,Constructing a Multivalued Representation for View Synthesis,2001,0,373,
1185707,On the Economic Analysis of Labor Market Institutions and Institutional Change.,1992,0,0,labour market ; law ; policy making ; game theory
1186519,Sample Size Determination if Interest is Directed Towards Rejecting Several Null Hypotheses Simultaneously,1996,1026,0,
1186885,Morphology of epitaxial TiN(001) grown by magnetron sputtering,1997,0,0,
1187300,Reconfigurable Architecture for Base-band Data Processing,2000,214,0,
1187639,Vascular endothelial growth factor induces interstitial collagenase expression in human endothelial cells,1992,0,7724,
1187665,Cootes Modeling the process of ageing in face images,1999,0,0,
1188242,New data acquisition system for the focal plane polarimeter of the Grand Raiden spectrometer,1996,0,8423,
1189225,RWBO(pdw): A Novel Backoff Algorithm for IEEE 802.11 DCF,2005,0,104,
1189602,Class AB CMOS analogue squarer circuit,2007,0,5222,
1189823,Gnass: a Gnat-based allocation and scheduling system,1996,248,0,
1189929,What Dreams Are Made of.,2003,0,15270,
1190551,Simultaneous Fine-grain Sleep Transistor Placement and Sizing for Leakage Optimization,0,97,0,
1191356,Plane-wave excited lens/reflector antennas made of uniaxially anisotropic metamaterials,2010,0,0,gradient index materials; lens antennas; reflectarray antennas; reflector antennas; uniaxial anisotropy
1191606,Modular Multiplication Architecture for Public Key Cryptosystem,2002,1,0,
1191848,Book Review:An Introduction to Social Psychology Charles A. Ellwood,1918,0,4915,
1192321,Mathematical programming approach to underground timetabling problem for maximizing time synchronization,2007,0,0,"Keywords: train timetabling problem, train scheduling, energy saving."
1192852,Influence of polymer structure on adsorption behavior at solid–liquid interface by Monte Carlo simulation,2007,0,2235,"Random copolymer,Block copolymer,Homopolymer,Surface adsorption,Monte Carlo simulation,Lattice model"
1193229,Order-Optimal Data Aggregation in Wireless Sensor Networks Using Cooperative Time-Reversal Communication,2006,1864,0,Cooperative Communication; Data Aggregation; Sensor Networks; Time Reversal
1193732,Jupiter's Short-Term Tropospheric and Stratospheric Thermal Dynamics Before and During the Cassini Encounter,2001,0,0,
1194203,Correlation of Viscoelastic Properties with Solvation of Regioregular Poly(3-decylthiophene) Films,2006,0,1880,
1194217,A general framework for second-order blind separation of stationary colored sources,2008,0,932,Blind source separation; Stationary colored sources; Second-order statistics
1194227,Performance of the holographic bubble chamber HOBC,1982,0,14035,Detectors and Experimental Techniques
1195718,Triclosan is minimally effective in rodent malaria models,2011,0,3940,
1196153,Kernel based text categorization,2001,2133,0,
1196529,Constraint Partitioning for Solving Planning Problems with Trajectory Constraints and Goal Preferences,2007,64,0,
1197917,An abstract representation of geometric knowledge for object classification,2003,0,419,Abstraction; Object classification; Constraint satisfaction; Geometric knowledge representation; Polygonal approximation
1197962,Gauge invariance and the cosmic microwave background radiation temperature,1995,0,11654,
1198051,On-line monitoring of hybridoma cell growth using a laser turbidity sensor,1992,0,1510,
1199182,Effects of Additional Elements on the Evolution of Second Phases in 9-12% cr Steel and Resulting Mechanical Properties,2009,0,8435,"9-12% Cr, aging, microstructural evolution, precipitates, mechanical properties"
1199235,"Complexity, Combinatorial Group Theory and the Language of Palutators",1988,0,269,
1199511,Dynamics of Automorphisms of Compact Complex Manifolds,2008,0,0,"Mathematics - Dynamical Systems, Mathematics - Algebraic Geometry, 14J50, 14E20, 32H50"
1199778,,1987,0,1462,
1200030,,0,0,0,
1200636,Molecular Self-Assembly Across Multiple Length Scales,2007,0,13179,
1201378,Juvenile Hawksbill Tagged in The Bahamas Nests in Tobago,0,0,0,
1201570,Peptide Orientation Affects Selectivity in Ion-Exchange Chromatography,2010,0,1880,
1201627,Automatic development of parallel simulation models in ADA,1988,520,0,
1201750,Performance of a dynamically wavelength-routed optical burst switched network,2002,0,8419,
1202336,Small Noise Asymptotics of the Bayesian Estimator in Nonidentifiable Models,1996,0,0,
1203155,THE DEVELOPMENT OF WIRELESS ELECTROCARDIOGRAPHY FOR BICYCLING AND STAIRS-CLIMBING,2007,0,3479,
1203526,Reviews of Books,2006,0,12194,
1204323,Computation of Coherent Optical Flow by Using Multiple Constraints,1995,20,0,
1204449,Reassessment of the Specificity of Lens Opacities in Myotonic Dystrophy,1996,0,4024,"Cataract,Myotonic dystrophy,Myotonic dystrophy mutation,Slit-lamp examination"
1204535,Endothelial Cell Density to Predict Endothelial Graft Failure After Penetrating Keratoplasty,2010,0,2633,
1204932,Assortative mating by body height and BMI: Finnish Twins and their spouses,2003,0,2501,
1205114,EFFECT OF THE PREFORMED COOKED CURED-MEAT PIGMENT (CCMP) ON COLOR PARAMETERS OF MUSCLE FOODS,1991,0,1295,
1205193,Molecular genetic analysis of variation in <i>Costaria costata</i> (Turner) Saunders,1987,0,8965,"Key words: seaweed, Costaria, divergence, genetic, population"
1205666,Luminosity Functions of Lyman Break Galaxies at z~4 and z~5 in the Subaru Deep Field,2006,0,11654,"Cosmology: Observations, Galaxies: Evolution, Galaxies: High-Redshift, Galaxies: Luminosity Function, Mass Function"
1207340,Distributed deviation detection in sensor networks,2003,0,253,
1208081,The Design of a Cryptopgraphy Based Secure File System,1980,0,27,Access control; cryptography; file security; one way ciphers; protection specifications
1209506,Molecular hydrogen n =3 triplet gerade complex disentangled,1991,0,8565,
1209871,Decrease in the descending inhibitory 5-HT system in rats with spinal nerve ligation,2010,0,7905,5-Hydroxytryptamine; 5-Hydroxytryptamine receptor; WDR neurons; Spinal cord; Neuropathic pain; Electrophysiology
1209919,,2008,0,11667,radiation mechanism: general; line: formation; X-ray: galaxies; galaxies: Seyfert; quasars: general; black hole physics
1210050,Are Lower-Order Gradient Theories of Plasticity Really Lower Order?,2002,0,0,
1210256,The MELODIE M-Dwarf Planet Survey,2000,0,0,
1211238,Effect of intensive treatment of diabetes of the risk of death or renal failure in NIDDM and IDDM,1997,0,3045,
1212728,Nutrient fluxes at the landscape level and the R* rule,2010,0,5982,Nutrient cycling; Tree growth; Vegetation modeling; Wetlands; Tree islands
1213675,Kinetic Study of Injected Gas Effects On Divertor Plasma Detachment *,-1,0,0,
1213943,The Complexity of Monotone Boolean Functions,1978,0,170,
1214663,Real-Time Object-Oriented Distributed Processing with COREMO,1997,910,0,
1215029,A Soft Hierarchical Algorithm for the Clustering of Multiple Bioactive Chemical Compounds,2007,1818,0,
1215209,Buddha's Brain: Neuroplasticity and Meditation [In the Spotlight],2008,0,5330,
1215510,SiO2/AlGaN/InGaN/GaN MOSDHFETs,2002,0,5312,
1215850,Transmission Problems Encountered When Testing Memory Devices in Parallel on Memory ATE,1986,101,0,
1215881,introduction to colloidal systems,2000,0,8558,
1216050,.es> Informática y Filosofía Informática y Filosofía Informática y Filosofía Informática y Filosofía Informática y Filosofía,0,0,0,
1217072,"Interpenetrating multiwall carbon nanotube electrodes for organic solar
   cells",2006,0,8359,Photoelectric conversion: solar cells and arrays
1217414,"Carotenoids in young and elderly healthy humans: dietary intakes, biochemical status and diet-plasma relationships",1999,0,3129,"carotenoids,dietary assessment,elderly,biomarkers"
1217673,Avaliação da confiabilidade em sistemas de ditribuição considerando falhas de geração e transmissão,2003,0,0,
1217724,Diffractive imaging based on a multipinhole plate,2009,0,8544,
1218575,Digital geometry image analysis for medical diagnosis,2006,324,0,"Keywords Digital geometry, Pattern recognition, Classifier, 3D f acial analysis, Medical diagnosis, Fetal alcohol syndrome."
1218840,A Microfluidic Device with On-Chip Optical Waveguide Interrogation of Individual Biological Cells for Medical Diagnostics,2003,33,0,
1219032,Emotional influences in memory and thinking: Data and theory,1982,0,0,
1219379,,2006,0,7737,creatine kinase; macromolecular crowding; protein refolding; folding kinetics; protein aggregation
1219647,,2002,304,0,
1219925,"Computational Logic - CL 2000, First International Conference, London, UK, 24-28 July, 2000, Proceedings",2000,577,0,
1220706,Acousto-Optics: introduction to the feature issue,2009,0,8355,
1220717,Overview of Planning speech acts,1977,64,0,
1221382,,2000,0,7741,
1222066,Formation of fold-and-thrust belts on Venus by thick-skinned deformation,1995,0,912,
1223546,Face Recognition Research Based on Anti-Symmetrical Wavelet and Eigenface,2007,0,0,Anti-symmetrical biorthogonal wavelet; Eigenface; Face recognition; SVD
1224316,"The interaction of the solar wind with Mars, Venus and Mercury",1979,0,0,
1224931,"Cockroach Allergen Reduction by Extermination Alone in Low-Income, Urban Homes-A Randomized Control Trial",2007,0,3443,
1225807,Dimensionality Reduction and Forecasting on Streams,0,0,0,
1226943,Tyrosine phosphorylation of GluR2 is required for insulin-stimulated AMPA receptor endocytosis and LTD,2004,0,7657,
1226996,IDENTIFICATION: IT'S PERFORMANCE THAT COUNTS,1972,0,4679,
1227268,Caregiver Report of Hallucinations and Paranoid Delusions in Elders Aged 70 or Older,2001,0,9699,
1228549,GAPS}: General and Automatic Polygon Simplification,1999,365,0,
1229247,On resource sharing in a distributed communication environment,1979,0,1041,
1229483,Visual inspection system for the classification of solder joints,1999,0,418,Machine vision; Classification; Industrial inspection; 3D sensing; Feature; Bayes classifier; Neural network
1229610,"Comparing Topological, Symbolic and GA-based ATPGs: An Experimental Approach",1996,101,0,mental point of view the pei$ormance of three ATPG for synchronous are
1230992,Misbinding of color to form in afterimages,2008,0,4437,
1232352,Positive Commutators in Non-Equilibrium Quantum Statistical Mechanics ,2000,0,0,"Keywords: positive commutator, Mourre estimate, return to equilibrium, virial theorem, Fermi golden rule"
1233113,A Set-Partitioning-Based Model for the Stochastic Vehicle Routing Problem,0,0,0,
1233254,A perturbation theory approach to relativistic calculations,1979,0,2234,
1233377,,0,0,0,
1234078,"A Simple and Efficient Separation of the Curcumins, the Antiprotozoal Constituents of Curcuma longa",2000,0,8305,
1234241,On the Impact of Future Land Use Assumptions on Risk Analysis for Superfund Sites,1997,0,5478,
1236328,The legacy of COBE.,1997,0,0,"Cosmic Microwave Background: Anisotropy, Cosmic Microwave Background: Space Research, Early Universe: Space Research"
1236557,A Matrix Alignment Approach for Collective Classification,2009,2659,0,Collective Classification; Network Mining; Social Networks
1236663,Complexity Results for First-Order Two-Variable Logic with Counting,2000,0,147,
1236801,Color Mix Prediction for Printed Textiles,1999,1184,0,
1237884,Time-stretched short time Fourier transform,2004,4139,0,
1238300,A condensed representation to find frequent patterns,2001,223,0,
1240002,Hierarchical cluster analysis for exposure assessment of workers in the semiconductor health study,2010,0,2503,
1240266,Epimorphisms and dominions. II,1967,0,7212,
1241350,The p47 GTPase Lrg-47 (Irgm1) Links Host Defense and Hematopoietic Stem Cell Proliferation,2008,0,2835,STEMCELL; CELLIMMUNO
1241546,,2001,0,22072,Key words: 2154: Planetary bow shocks; 2114: Energetic particles; 2194: Instruments and techniques
1241555,Galactic rotation measurements based on H2O maser astrometry with VERA,2007,0,15029,"ISM:star forming regions, ISM:individual(Sharpless 269), masers (H2O), VERA"
